Product Code/SKU,Product Name,Cost Price,Selling Price,Product URL,Description,Product Image1,Product Image2,Size,Quantity
171636,New Balance LD5000v5 Spike - White Munsell/Flame,8797.5,10617.125,http://www.prodirectrunning.com/products/New-Balance-LD5000v5-Spike-White-Munsell-Flame-Mens-Shoes-MLD5KWR5-171636.aspx,The full-length Pebax® plate and 4-spike configuration help provide the NB 5000v5 with optimal traction to energise your run mile after mile.,http://www.prodirectrunning.com//productimages/V3_1_Main/171636.jpg,http://www.prodirectrunning.com//productimages/V3_1_Gallery_1/171636.jpg,12,5
171647,New Balance Unisex Spike - White Munsell/Black,9180.0,11057.0,http://www.prodirectrunning.com/products/New-Balance-Unisex-Spike-White-Munsell-Black-Mens-Shoes-USD200W3-171647.aspx,,http://www.prodirectrunning.com//productimages/V3_1_Main/171647.jpg,http://www.prodirectrunning.com//productimages/V3_1_Gallery_1/171647.jpg,12,5
169674,Nike Unisex Air Zoom Speed Racer 6 - Football Blue/Blue Fox/Bright Crimson,7310.0,8906.5,http://www.prodirectrunning.com/products/Nike-Unisex-Air-Zoom-Speed-Racer-6-Football-Blue-Blue-Fox-Bright-Crimson-Mens-Shoes-749360446-169674.aspx,"The Nike Air Zoom Speed Racer 6 running shoe has Flywire cables that wrap your foot in secure comfort, while its engineered mesh upper provides lightweight breathability.",http://www.prodirectrunning.com//productimages/V3_1_Main/169674.jpg,http://www.prodirectrunning.com//productimages/V3_1_Gallery_1/169674.jpg,12,5
171637,New Balance MD800v5 Spike - Black/Flame,6502.5,7977.875,http://www.prodirectrunning.com/products/New-Balance-MD800v5-Spike-Black-Flame-Mens-Shoes-MMD800B5-171637.aspx,"An aggressive 6-spike Pebax® plate, snug fit and lightweight materials make the 800v5 competition racing spike the shoe designed to go anywhere from 400m to a jaunty 3k.",http://www.prodirectrunning.com//productimages/V3_1_Main/171637.jpg,http://www.prodirectrunning.com//productimages/V3_1_Gallery_1/171637.jpg,12,5
147402,Saucony Guide 9 - Midnight/Citron/Orange,4930.0,6169.5,http://www.prodirectrunning.com/products/Saucony-Guide-9-Midnight-Citron-Orange-Mens-Shoes-S202953-147402.aspx,"Experience the energy return of EVERUN. The Saucony Guide 9 features EVERUN technology, which delivers a noticeably livelier and more responsive ride. Placed close to the foot, it provides smoother landings and reduces pressure in the forefoot. Featuring FlexFilm, a strong yet lightweight fabric, the Saucony Guide 9 requires fewer layers of material in the upper, thereby creating a soft and virtually seamless feel against the runner’s foot.Made from durable rubber, the TRI-FLEX outsole increases force dispersion over a greater surface area and delivers optimal flexibility and traction.With an offset of 8mm, the high-mileage Saucony Guide 9 is great for midfoot strikers or light heel strikers who are trying to develop a more natural gait.",http://www.prodirectrunning.com//productimages/V3_1_Main/147402.jpg,http://www.prodirectrunning.com//productimages/V3_1_Gallery_1/147402.jpg,13,5
169643,Nike Free RN Distance 2 - Black/White/Deep Royal Blue/Hot Punch,8415.0,10177.25,http://www.prodirectrunning.com/products/Nike-Free-RN-Distance-2-Black-White-Deep-Royal-Blue-Hot-Punch-Mens-Shoes-863775009-169643.aspx,,http://www.prodirectrunning.com//productimages/V3_1_Main/169643.jpg,http://www.prodirectrunning.com//productimages/V3_1_Gallery_1/169643.jpg,12,5
171645,New Balance Vazee Verge - Black/Silver,6502.5,7977.875,http://www.prodirectrunning.com/products/New-Balance-Vazee-Verge-Sprint-Spike-Black-Silver-Mens-Shoes-MSDVGEBB-171645.aspx,"The Vazee Verge features a lightweight, supportive FantomFit upper and an aggressive 8-spike plate so you can concentrate on your speed and aim for a PB.",http://www.prodirectrunning.com//productimages/V3_1_Main/171645.jpg,http://www.prodirectrunning.com//productimages/V3_1_Gallery_1/171645.jpg,12,5
153391,Nike Free RN Flyknit 2017 - Black/White/Black,6800.0,8320.0,http://www.prodirectrunning.com/products/Nike-Free-RN-Flyknit-2017-Black-White-Black-Mens-Shoes-880843001-153391.aspx,"The Nike Free RN Flyknit 2017 has been designed to provide exceptional comfort that will go the distance. The one-piece Flyknit upper construction features zoned stretch and support and integrates with the laces for a dynamic and supportive fit.Made of a low-profile injected unit sole foam, the Nike Free RN Flyknit 2017 delivers resilient cushioning that is durable enough to double as the outsole, resulting in a much lighter weight shoe. Finished with a tri-star outsole pattern, the shoe adjusts to every step for flexibility and support.",http://www.prodirectrunning.com//productimages/V3_1_Main/153391.jpg,http://www.prodirectrunning.com//productimages/V3_1_Gallery_1/153391.jpg,13,5
169681,Nike Zoom Rival M 8 - Football Blue/Blue Fox-Bright Crimson,5015.0,6267.25,http://www.prodirectrunning.com/products/Nike-Zoom-Rival-M-8-Football-Blue-Blue-FoxBright-Crimson-Mens-Shoes-806555446-169681.aspx,The Nike Zoom Rival M 8 fits like a second skin with ultra-lightweight single-layer mesh with Phylon foam in the heel for responsive cushioning.,http://www.prodirectrunning.com//productimages/V3_1_Main/169681.jpg,http://www.prodirectrunning.com//productimages/V3_1_Gallery_1/169681.jpg,13,5
166587,Nike Air Zoom Structure 21 - Deep Royal Blue/Metallic Silver/Black,8032.5,9737.375,http://www.prodirectrunning.com/products/Nike-Air-Zoom-Structure-21-Deep-Royal-Blue-Metallic-Silver-Black-Mens-Shoes-904695401-166587.aspx,"The Air Zoom Structure 21 features updates that make it stronger, lighter and more supportive than ever before. With a revamped engineered mesh upper, the shoe brings you lightweight breathability and greater durability.A full inner mesh bootie wraps the foot to further the breathability while creating a comfortable, sock-like fit. Featuring a dual-density midsole and Dynamic Support system in the midfoot, the Structure 21 cushions each stride and provides secure, locked-down support.",http://www.prodirectrunning.com//productimages/V3_1_Main/166587.jpg,http://www.prodirectrunning.com//productimages/V3_1_Gallery_1/166587.jpg,12,5
169703,Nike Unisex Zoom Celar 5 - Bright Crimson/Blue Fox/White,6885.0,8417.75,http://www.prodirectrunning.com/products/Nike-Unisex-Zoom-Celar-5-Bright-Crimson-Blue-Fox-White-Mens-Shoes-629226614-169703.aspx,"The Nike Unisex Zoom Celar 5 features an ultra-thin TPU structure, supportive Flywire technology and lightweight spike plate.",http://www.prodirectrunning.com//productimages/V3_1_Main/169703.jpg,http://www.prodirectrunning.com//productimages/V3_1_Gallery_1/169703.jpg,14,5
169650,Nike Air Vapormax Flyknit - Midnight Fog/Multi/Black,14450.0,17117.5,http://www.prodirectrunning.com/products/Nike-Air-Vapormax-Flyknit-Midnight-Fog-Multi-Black-Mens-Shoes-849558009-169650.aspx,"By removing layers and only placing cushioning where it’s really needed, the Nike Air VaporMax Flyknit is a running shoe that boasts an incredibly light and flexible feel. Constructed with VaporMax Air technology, you can enjoy soft, lightweight responsiveness from start to finish.From the no-sew overlays to the Flyknit upper construction, these shoes enhance your comfort and breathability while offering support.Please note: due to high demand these will be limited to 1 pair per customer.",http://www.prodirectrunning.com//productimages/V3_1_Main/169650.jpg,http://www.prodirectrunning.com//productimages/V3_1_Gallery_1/169650.jpg,12,5
174267,adidas UltraBOOST - Core Black,12750.0,15162.5,http://www.prodirectrunning.com/products/Mens-Shoes-adidas-UltraBOOST-Core-Black-BB6166-174267.aspx,,http://www.prodirectrunning.com//productimages/V3_1_Main/174267.jpg,http://www.prodirectrunning.com//productimages/V3_1_Gallery_1/174267.jpg,12.5,5
170981,Brooks Adrenaline GTS 18 - Black/Silver/White,9180.0,11057.0,http://www.prodirectrunning.com/products/Brooks-Adrenaline-GTS-18-Black-Silver-White-Mens-Shoes-1102711D091-170981.aspx,"It’s a great feeling when you find a running shoe that’s a pleasure to wear, rather than just being a piece of equipment. And that’s exactly the feeling you get with the new Adrenaline GTS 18 from Brooks. With a redesigned, streamlined upper, the GTS 18 is now one of the most comfortable – not to mention best looking – all-round runners on the market, with softer cushioning, reliable support, and breathable ventilation.",http://www.prodirectrunning.com//productimages/V3_1_Main/170981.jpg,http://www.prodirectrunning.com//productimages/V3_1_Gallery_1/170981.jpg,12,5
169675,Nike Unisex Air Zoom Speed Rival 6 - Football Blue/Blue Fox/Bright Crimson,5355.0,6658.25,http://www.prodirectrunning.com/products/Nike-Unisex-Air-Zoom-Speed-Rival-6-Football-Blue-Blue-Fox-Bright-Crimson-Mens-Shoes-880553446-169675.aspx,"The Nike Air Zoom Speed Rival 6 was designed and developed for the training needs of the Japanese Ekiden, a long-distance relay race. It comes equipped with midfoot lockdown straps, lightweight engineered mesh and a responsive Zoom Air unit.",http://www.prodirectrunning.com//productimages/V3_1_Main/169675.jpg,http://www.prodirectrunning.com//productimages/V3_1_Gallery_1/169675.jpg,12,5
169638,Nike Free RN Flyknit 2017 - Deep Royal Blue/Wolf Grey/Photo Blue,8415.0,10177.25,http://www.prodirectrunning.com/products/Nike-Free-RN-Flyknit-2017-Deep-Royal-Blue-Wolf-Grey-Photo-Blue-Mens-Shoes-880843405-169638.aspx,,http://www.prodirectrunning.com//productimages/V3_1_Main/169638.jpg,http://www.prodirectrunning.com//productimages/V3_1_Gallery_1/169638.jpg,12.5,5
169639,Nike Lunarepic Low Flyknit 2 - College Navy/Black/Concord/Cool Grey,10710.0,12816.5,http://www.prodirectrunning.com/products/Nike-Lunarepic-Low-Flyknit-2-College-Navy-Black-Concord-Cool-Grey-Mens-Shoes-863779406-169639.aspx,,http://www.prodirectrunning.com//productimages/V3_1_Main/169639.jpg,http://www.prodirectrunning.com//productimages/V3_1_Gallery_1/169639.jpg,12,5
173618,ASICS Gel-Nimbus 20 - Sulphur Spring/Black/White,12750.0,15162.5,http://www.prodirectrunning.com/products/ASICS-GelNimbus-20-Sulphur-Spring-Black-White-T800N8990-173618.aspx,The ASICS Gel-Nimbus 20 high mileage running trainer is equipped with a gradient jacquard-mesh FluidFit upper that strategically adapts to your foot's natural motion. 3-D printed overlays offer extra support to the upper that provides a customised fit.,http://www.prodirectrunning.com//productimages/V3_1_Main/173618.jpg,http://www.prodirectrunning.com//productimages/V3_1_Gallery_1/173618.jpg,13,5
166593,adidas Adizero Prime LTD - Red,13600.0,16140.0,http://www.prodirectrunning.com/products/adidas-Adizero-Prime-LTD-Red-Mens-Shoes-CQ1834-166593.aspx,"The neutral high-mileage adidas adizero Prime LTD running trainers are inspired by the original adizero Prime that debuted in London in 2012.The shoes' upper boasts the adaptive comfort of Primeknit, while underfoot benefits from the explosive energy of boost.",http://www.prodirectrunning.com//productimages/V3_1_Main/166593.jpg,http://www.prodirectrunning.com//productimages/V3_1_Gallery_1/166593.jpg,12,5
173619,ASICS Gel-Nimbus 20 - Black/White/Carbon,12750.0,15162.5,http://www.prodirectrunning.com/products/ASICS-GelNimbus-20-Black-White-Carbon-T800N9001-173619.aspx,The ASICS Gel-Nimbus 20 high mileage running trainer is equipped with a gradient jacquard-mesh FluidFit upper that strategically adapts to your foot's natural motion. 3-D printed overlays offer extra support to the upper that provides a customised fit.,http://www.prodirectrunning.com//productimages/V3_1_Main/173619.jpg,http://www.prodirectrunning.com//productimages/V3_1_Gallery_1/173619.jpg,13,5
169676,Nike Unisex Zoom Streak Lt 3 - Black/White/Volt,6120.0,7538.0,http://www.prodirectrunning.com/products/Nike-Unisex-Zoom-Streak-Lt-3-Black-White-Volt-Mens-Shoes-819038017-169676.aspx,The Nike Zoom Streak LT 3 has a wider forefoot to increase toe spring and a midfoot shank that adds even more response.,http://www.prodirectrunning.com//productimages/V3_1_Main/169676.jpg,http://www.prodirectrunning.com//productimages/V3_1_Gallery_1/169676.jpg,13,5
169677,Nike Unisex Zoom Streak Lt 3 - Bright Crimson/Blue Fox/University Red,6120.0,7538.0,http://www.prodirectrunning.com/products/Nike-Unisex-Zoom-Streak-Lt-3-Bright-Crimson-Blue-Fox-University-Red-Mens-Shoes-819038614-169677.aspx,The Nike Zoom Streak LT 3 has a wider forefoot to increase toe spring and a midfoot shank that adds even more response.,http://www.prodirectrunning.com//productimages/V3_1_Main/169677.jpg,http://www.prodirectrunning.com//productimages/V3_1_Gallery_1/169677.jpg,13,5
171098,Saucony Liberty ISO - Blue/White/Black,12750.0,15162.5,http://www.prodirectrunning.com/products/Mens-Shoes-Saucony-Liberty-ISO-Blue-White-Black-S204102-171098.aspx,,http://www.prodirectrunning.com//productimages/V3_1_Main/171098.jpg,http://www.prodirectrunning.com//productimages/V3_1_Gallery_1/171098.jpg,13,5
169702,Nike Unisex Zoom Celar 5 - Black/White/Volt,7650.0,9297.5,http://www.prodirectrunning.com/products/Nike-Unisex-Zoom-Celar-5-Black-White-Volt-Mens-Shoes-629226017-169702.aspx,"The Nike Unisex Zoom Celar 5 features an ultra-thin TPU structure, supportive Flywire technology and lightweight spike plate.",http://www.prodirectrunning.com//productimages/V3_1_Main/169702.jpg,http://www.prodirectrunning.com//productimages/V3_1_Gallery_1/169702.jpg,13,5
155224,Mizuno Wave Shadow - Safety Yellow/Red Orange/Jasmine Green,6885.0,8417.75,http://www.prodirectrunning.com/products/Mizuno-Wave-Shadow-Safety-Yellow-Red-Orange-Jasmine-Green-Mens-Shoes-J1GC173054-155224.aspx,"Sharing many similarities with the Sayonara, the Wave Shadow from Mizuno delivers the fast and responsive ride you know and love. Meanwhile, the all-new design is set to provide an even faster training option that’s ready to tackle anything from uptempo days to interval workouts.The new midfoot CloudWave with U4icX heel cushioning combines with a U4icX strobel lining to bring you softer landings and a snappy toe-off. With an 8mm offset, the Shadow offers a slightly more natural feel.The X10 rubber outsole is designed in a new forefoot zig-zag pattern that encourages flexibility and delivers on durability, too. Finished with a three panel upper with Dynamotion fit, the Shadow allows for a seamless midfoot construction and superb breathability.",http://www.prodirectrunning.com//productimages/V3_1_Main/155224.jpg,http://www.prodirectrunning.com//productimages/V3_1_Gallery_1/155224.jpg,12,5
153397,Nike Free Rn 2017 - Black/White-Dark Grey-Anthracite,6120.0,7538.0,http://www.prodirectrunning.com/products/Nike-Free-Rn-2017-Black-WhiteDark-GreyAnthracite-Mens-Shoes-880839001-153397.aspx,"Updated to reduce the layers and weight, the Nike Free RN 2017 brings you mile after mile of comfort. Featuring a breathable circular-knit upper, the shoe has an improved 1:1 fit and better support. Low-profile cushioning encourages a more natural footstrike while a minimal, moulded sockliner mimics the curvature of your foot for enhanced support.With a tri-star outsole pattern, the shoe adjusts to your foot’s every step, expanding and contracting for flexible cushioning. Finally, segments of solid rubber under the toe and heel enhance traction and durability.",http://www.prodirectrunning.com//productimages/V3_1_Main/153397.jpg,http://www.prodirectrunning.com//productimages/V3_1_Gallery_1/153397.jpg,14,5
163669,adidas Adizero Javelin - Mystery Petrol F17/Ftwr White/Petrol Night F17,7650.0,9297.5,http://www.prodirectrunning.com/products/adidas-Adizero-Javelin-Mystery-Petrol-F17-Ftwr-White-Petrol-Night-F17-Mens-Shoes-BB3538-163669.aspx,"Featuring a moulded hook and loop strap over the midfoot, the Adizero Javelin from adidas is designed to keep your feet locked in for security. The sharkskin outsole and abrasion-resistant toe cap enhance the durability, while the forefoot and rearfoot spikes offer excellent grip in both wet and dry conditions.",http://www.prodirectrunning.com//productimages/V3_1_Main/163669.jpg,http://www.prodirectrunning.com//productimages/V3_1_Gallery_1/163669.jpg,12,5
96638,adidas adizero MD 2 - Nightflash/White/Solar Red,4675.0,5876.25,http://www.prodirectrunning.com/products/Mens-Shoes-adidas-adizero-MD-2-Nightflash-White-Solar-Red-B40248-96638.aspx,"adidas adizero MD 2 - Nightflash/White/Solar RedThe mid-distance adizero™ MD 2 Shoes by adidas get you to your fastest 400m ever and feature a breathable air mesh upper, a cushioned insole and a lightweight Pebax plate.",http://www.prodirectrunning.com//productimages/V3_1_Main/96638.jpg,http://www.prodirectrunning.com//productimages/V3_1_Gallery_1/96638.jpg,12.5,5
146387,Saucony Hurricane ISO 3 - Blue/White/Silver,7225.0,8808.75,http://www.prodirectrunning.com/products/Saucony-Hurricane-ISO-3-Blue-White-Silver-Mens-Shoes-S203482-146387.aspx,"With plush cushioning, the Hurricane ISO 3 will keep you feeling comfortable throughout your run. Engineered for moderate to severe overpronators, the shoe offers stability without compromising on comfort. The full-length EVERUN topsole and landing zone help absorb shock and charge each stride with energy-returning properties. Featuring an engineered mesh upper and the revolutionary ISOFIT system, the Hurricane ISO 3 delivers a dynamic fit, breathability and great flexibility.The Hurricane ISO 3 features an iBR+ blown rubber outsole in a TRI-FLEX design provides greater ground contact, in addition to better flexibility and improved durability.",http://www.prodirectrunning.com//productimages/V3_1_Main/146387.jpg,http://www.prodirectrunning.com//productimages/V3_1_Gallery_1/146387.jpg,12,5
155355,Asics Womens Gel-Kayano 24 -Flash Coral/Black/White,8925.0,10763.75,http://www.prodirectrunning.com/products/Asics-Womens-GelKayano-24-Flash-Coral-Black-White-Womens-Shoes-T799N0690-155355.aspx,"The ASICS Gel-Kayano 24 was made for long distance running, featuring an even lighter weight design and exceptional, long-lasting cushioned comfort. With more than twenty years of experience behind it, this shoe offers precision support, with structure that’s designed to help correct overpronation.With a fibre-reinforced midsole, the Kayano 24 adapts to your foot shape, providing cushioning that increases the stability the more you roll your foot.Thanks to the outstanding FlyteFoam midsole, updated to be even lighter than previous versions, the Kayano 24 attenuates shock while simultaneously allowing for a snappy response.",http://www.prodirectrunning.com//productimages/V3_1_Main/155355.jpg,http://www.prodirectrunning.com//productimages/V3_1_Gallery_1/155355.jpg,8,5
153431,Nike Womens Lunarepic Low Flyknit 2 - Dark Raisin/White/Purple Earth,5525.0,6853.75,http://www.prodirectrunning.com/products/Nike-Womens-Lunarepic-Low-Flyknit-2-Dark-Raisin-White-Purple-Earth-Womens-Shoes-863780500-153431.aspx,"The Lunarepic Low Flyknit 2 features a plush Flyknit bootie construction that wraps the foot for a more secure and locked-in fit. The seamless upper reduces the potential for irritation and chafing, leading to a more comfortable shoe and fewer distractions when running.The Flyknit construction not only creates a locked-in feel but allows for great ventilation to keep your feet feeling comfortable as you run.With a contoured Lunarlon foam midsole, the Lunarepic Low Flyknit 2 delivers an extremely smooth ride and comfort that lasts for miles. The outsole features pressure-mapped Lunarlon pods in key areas to target the cushioning, while laser cuts on the pods helps to absorb impact and disperse it more evenly across your foot.",http://www.prodirectrunning.com//productimages/V3_1_Main/153431.jpg,http://www.prodirectrunning.com//productimages/V3_1_Gallery_1/153431.jpg,8,5
149118,New Balance Womens Hanzo S - Pink,5100.0,6365.0,http://www.prodirectrunning.com/products/New-Balance-Womens-Hanzo-Pink-Womens-Shoes-WHANZSP1-149118.aspx,"REVlite midsole foam ensures a comfortable and responsive ride, while the Fantom Fit technology creates a snug and secure fit for a distraction-free run that will propel you to the finish line. Rapid Rebound provides premium cushioning and caters for enhanced comfort, keeping you feeling light and comfortable from start to finish.The synthetic/mesh upper improves breathability and the no-sew material application enhances the overall comfort.",http://www.prodirectrunning.com//productimages/V3_1_Main/149118.jpg,http://www.prodirectrunning.com//productimages/V3_1_Gallery_1/149118.jpg,8,5
153425,Nike Womens Free RN Distance 2 - Hyper Grape/Lava Glow/Court Purple,4505.0,5680.75,http://www.prodirectrunning.com/products/Nike-Womens-Free-RN-Distance-2-Hyper-Grape-Lava-Glow-Court-Purple-Womens-Shoes-863776502-153425.aspx,Combining a nested auxetic design on the outsole for tuned flexibility and a partial woven upper for enhanced durability creates a shoe that feels comfortable and secure mile after mile.The Free RN Distance 2 also features a free-floating mesh bootie for a more stable feel as well as improved ventilation.,http://www.prodirectrunning.com//productimages/V3_1_Main/153425.jpg,http://www.prodirectrunning.com//productimages/V3_1_Gallery_1/153425.jpg,8,5
153420,Nike Womens Lunarepic Low Flyknit 2 - Wolf Grey/Black/Cool Grey/Pure Platinum,5525.0,6853.75,http://www.prodirectrunning.com/products/Nike-Womens-Lunarepic-Low-Flyknit-2-Wolf-Grey-Black-Cool-Grey-Pure-Platinum-Womens-Shoes-863780002-153420.aspx,"The Lunarepic Low Flyknit 2 features a plush Flyknit bootie construction that wraps the foot for a more secure and locked-in fit. The seamless upper reduces the potential for irritation and chafing, leading to a more comfortable shoe and fewer distractions when running.The Flyknit construction not only creates a locked-in feel but allows for great ventilation to keep your feet feeling comfortable as you run.With a contoured Lunarlon foam midsole, the Lunarepic Low Flyknit 2 delivers an extremely smooth ride and comfort that lasts for miles. The outsole features pressure-mapped Lunarlon pods in key areas to target the cushioning, while laser cuts on the pods helps to absorb impact and disperse it more evenly across your foot.",http://www.prodirectrunning.com//productimages/V3_1_Main/153420.jpg,http://www.prodirectrunning.com//productimages/V3_1_Gallery_1/153420.jpg,8,5
146295,Asics Womens fuzeX Rush - Midgrey/Black/White,4080.0,5192.0,http://www.prodirectrunning.com/products/Asics-Womens-Fuze-X-Rush-Midgrey-Black-White-Womens-Shoes-T768N9690-146295.aspx,"The seamless construction of the ASICS fuzeX Rush Running Shoe reduces irritation and friction caused by stitching and seams, ensuring a comfortable fit that minimises distractions and keeps you focussed on your run.With the addition of fuzeGEL cushioning from heel to toe, the shoe delivers lightweight and adaptable comfort, designed to provide rearfoot shock absorption that shifts to forefoot bounce-back. For added protection and comfort, the fuzeX Rush features a sockliner, which can be removed to accommodate a medical orthotic if required.  A high abrasion rubber has been strategically placed on the critical areas of the outsole, ensuring maximum durability.",http://www.prodirectrunning.com//productimages/V3_1_Main/146295.jpg,http://www.prodirectrunning.com//productimages/V3_1_Gallery_1/146295.jpg,8,5
153434,Nike Womens Air Zoom Vomero 12 - Lava Glow/Black/Racer Pink/Sunset Glow,4930.0,6169.5,http://www.prodirectrunning.com/products/Nike-Womens-Air-Zoom-Vomero-12-Lava-Glow-Black-Racer-Pink-Sunset-Glow-Womens-Shoes-863766601-153434.aspx,"The upper has been designed to provide ultimate comfort and ventilation where you need it the most. With a 3/4 length internal bootie, the Vomero 12 wraps the foot for a sock-like fit and features a thick foam collar to add support and comfort to the ankle. The upper has been finished with Flywire cables which create an adaptive and supportive fit.A dual-density midsole combines a soft Lunar core foam with a firmer Cushlon foam for a smooth heel-to-toe transition. The addition of Zoom Air units in the heel and forefoot help make the Vomero 12 and exceptionally energy-returning shoe.With a lightweight foam outsole, the Vomero 12 provides improved traction and durability. The updated rubber crash rail works to smooth transitions and enhance flexibility while segmented rubber under the heel further enhances the durability in critical areas of the shoe.",http://www.prodirectrunning.com//productimages/V3_1_Main/153434.jpg,http://www.prodirectrunning.com//productimages/V3_1_Gallery_1/153434.jpg,8,5
148990,Nike Womens Lunarepic Low Flyknit 2 - Hot Punch/Black-Aluminum-University Blue,5525.0,6853.75,http://www.prodirectrunning.com/products/Nike-Womens-Lunarepic-Low-Flyknit-2-Hot-Punch-BlackAluminumUniversity-Blue-Womens-Shoes-863780600-148990.aspx,"The Lunarepic Low Flyknit 2 features a plush Flyknit bootie construction that wraps the foot for a more secure and locked-in fit. The seamless upper reduces the potential for irritation and chafing, leading to a more comfortable shoe and fewer distractions when running.The Flyknit construction not only creates a locked-in feel but allows for great ventilation to keep your feet feeling comfortable as you run.With a contoured Lunarlon foam midsole, the Lunarepic Low Flyknit 2 delivers an extremely smooth ride and comfort that lasts for miles. The outsole features pressure-mapped Lunarlon pods in key areas to target the cushioning, while laser cuts on the pods helps to absorb impact and disperse it more evenly across your foot.",http://www.prodirectrunning.com//productimages/V3_1_Main/148990.jpg,http://www.prodirectrunning.com//productimages/V3_1_Gallery_1/148990.jpg,8,5
