Product Code/SKU,Product Name,Cost Price,Selling Price,Product URL,Description,Product Image1,Product Image2,Size,Quantity
161762,Under Armour Speedform Europa RE - Overcast Gray,7735.0,9395.25,http://www.prodirectrunning.com/products/Under-Armour-Speedform-Europa-RE-Overcast-Gray-Mens-Shoes-1292431100-161762.aspx,"The Speedform Europa RE from Under Armour is more than just a running shoe; with a built-in chip, it syncs with UA MapMyRun for GPS tracking and by using a simple jump test, this shoe can tell you the intensity your next run should be. The Record-Equipped technology tracks, stores and analyses your running metrics, giving you a deeper insight and allowing you to pinpoint exactly what you need to do to get better.Designed with a Charged Cushioning midsole, the Speedform Europa RE works to absorb the impact of your footstrike and convert it into responsive comfort. An embedded sockliner adds to the cushioning, support and comfort, while a dual-density medial post inside the shoe promotes a more natural gait cycle and helps reduce overpronation.The upper features a lightweight mesh for an enhanced fit and exceptional ventilation, ensuring that the air flows easily throughout the shoe. An external TPU heel counter finishes off the upper to give you additional support and structure, while coreshort midfoot panels provide ultimate lockdown.Finally, these running shoes boast a combination of blown rubber and high abrasion rubber on the outsole to bring you mile after mile of lightweight, shock-absorbing traction and durability.P.S – there’s no need to worry about losing charge as the optimised battery is designed to keep going way beyond your shoes’ recommended life span of around 400 miles.",http://www.prodirectrunning.com//productimages/V3_1_Main/161762.jpg,http://www.prodirectrunning.com//productimages/V3_1_Gallery_1/161762.jpg,12,5
153445,Nike Unisex Zoom Mamba 3 - Hyper Cobalt/White/Black/Ghost Green,5610.0,6951.5,http://www.prodirectrunning.com/products/Nike-Unisex-Zoom-Mamba-3-Hyper-Cobalt-White-Black-Ghost-Green-Mens-Shoes-706617413-153445.aspx,"Reshaped for the steeplechase, the Nike Zoom Mamba 3 features a 2-piece articulated plate to clear hurdles with ease, a carbon fiber shank for responsive snap off the ground and upper perforations for water drainage - leaving you dry and light to maintain your speed.The shoe additionally features midfoot traction to help grip the water barrier upon landing and Neoprene collar stretches for a glove-like fit.Most suitable for long distance events.",http://www.prodirectrunning.com//productimages/V3_1_Main/153445.jpg,http://www.prodirectrunning.com//productimages/V3_1_Gallery_1/153445.jpg,13,5
168298,adidas UltraBOOST - Core Black/Core Black/Utility Black,10710.0,12816.5,http://www.prodirectrunning.com/products/adidas-UltraBOOST-Core-Black-Core-Black-Utility-Black-Mens-Shoes-S80731-168298.aspx,,http://www.prodirectrunning.com//productimages/V3_1_Main/168298.jpg,http://www.prodirectrunning.com//productimages/V3_1_Gallery_1/168298.jpg,12,5
153446,Nike Unisex Zoom Maxcat 4 - Hyper Cobalt/White/Black-Ghost Green,5355.0,6658.25,http://www.prodirectrunning.com/products/Nike-Unisex-Zoom-Maxcat-4-Hyper-Cobalt-White-BlackGhost-Green-Mens-Shoes-549150413-153446.aspx,"The Nike Zoom Maxcat 4 Track Spike is ideal for 100m-800m sprints and is made with an ultra-lightweight mesh upper with Dynamic Flywire bundles for confident midfoot lockdown.The shoe features a low-profile Phylon midsole wedge to provide cushioning, while keeping the shoe light and low to the track.",http://www.prodirectrunning.com//productimages/V3_1_Main/153446.jpg,http://www.prodirectrunning.com//productimages/V3_1_Gallery_1/153446.jpg,12,5
168299,adidas UltraBOOST - Dark Burgundy/Dark Burgundy/Core Black,11900.0,14185.0,http://www.prodirectrunning.com/products/adidas-UltraBOOST-Dark-Burgundy-Dark-Burgundy-Core-Black-Mens-Shoes-S80732-168299.aspx,,http://www.prodirectrunning.com//productimages/V3_1_Main/168299.jpg,http://www.prodirectrunning.com//productimages/V3_1_Gallery_1/168299.jpg,12,5
171889,Hoka Clifton 3 - Blue/Red/Orange,5100.0,6365.0,http://www.prodirectrunning.com/products/Hoka-Clifton-3-Blue-Red-Orange-Mens-Shoes-1012046BRON-171889.aspx,"The Clifton 3 improves upon its decorated heritage with this new release.The third model of the popular Clifton range by Hoka boasts impressive features and updates. Building on an already solid platform, the Clifton 3 has a slightly wider toe box and a no-sew speed frame upper, which is constructed with a brand new mesh material for superb breathability and comfort. The fabric is tougher and more durable than the mesh used on its predecessor. With a thick layer of CMEVA foam, the midsole on the Clifton 3 truly stands out as special; rocker technology means the shoe tapers up slightly in the front and back for a smoother ride. A design of this nature means that your foot is propelled forwards, no matter where your foot strikes.The outsole features strategically placed high abrasion rubber material that wraps all the way up the toe for enhanced durability. With a similar ride to the Clifton 2, the third in the range provides enough cushioning and comfort for any distance.",http://www.prodirectrunning.com//productimages/V3_1_Main/171889.jpg,http://www.prodirectrunning.com//productimages/V3_1_Gallery_1/171889.jpg,13.5,5
137850,New Balance Fresh Foam Vongo - Blue/Black,5525.0,6853.75,http://www.prodirectrunning.com/products/New-Balance-Fresh-Foam-Vongo-Blue-Black-Mens-Shoes-MVNGOBY-137850.aspx,"The first men’s stability shoe in the Fresh Foam family, the Fresh Foam Vongo uses an innovative, one-piece midsole to deliver the support you need. Combined with breathable mesh for comfort and a perforated midfoot wrap for structured flexibility, you’re ready for the long run.",http://www.prodirectrunning.com//productimages/V3_1_Main/137850.jpg,http://www.prodirectrunning.com//productimages/V3_1_Gallery_1/137850.jpg,12.5,5
171629,New Balance FuelCore Rush - Black,5270.0,6560.5,http://www.prodirectrunning.com/products/New-Balance-FuelCore-Rush-Black-Mens-Shoes-MRUSHSB3-171629.aspx,The New Balance FuelCore Rush gives a lightweight and secure ride. The engineered mesh which is a new addition for this model gives support in key areas while remaining flexible and breathable.,http://www.prodirectrunning.com//productimages/V3_1_Main/171629.jpg,http://www.prodirectrunning.com//productimages/V3_1_Gallery_1/171629.jpg,12,5
167402,Brooks Levitate - Blue/Silver/Black,10710.0,12816.5,http://www.prodirectrunning.com/products/Brooks-Levitate-Blue-Silver-Black-Mens-Shoes-1102691D406-167402.aspx,"Made for those who can't stop, won't stop, every feature of the Brooks Levitate has been designed to give the most energy return of leading performance men's running shoes for a springy, responsive ride. Created in partnership with chemistry giant BASF, the DNA AMP midsole uses polyurethane foam wrapped in a TPU skin to capture the energy created by each footstrike and give it straight back to you.The fit knit upper comfortably accomodates your foot as it moves and expands for an intuitive fit while a flexible arrow-point pattern on the outsole helps you move from heel to toe quickly, without losing energy.",http://www.prodirectrunning.com//productimages/V3_1_Main/167402.jpg,http://www.prodirectrunning.com//productimages/V3_1_Gallery_1/167402.jpg,14,5
173868,Nike Zoom Matumbo 3 OC - Multi/Multi,5610.0,6951.5,http://www.prodirectrunning.com/products/Nike-Zoom-Matumbo-3-OC-Multi-Multi-Mens-Shoes-882014999-173868.aspx,"The Nike Zoom Matumbo 3 has an ultra-breathable mesh upper that delivers a minimal feel, while its Cushlon midsole offers response and comfort.",http://www.prodirectrunning.com//productimages/V3_1_Main/173868.jpg,http://www.prodirectrunning.com//productimages/V3_1_Gallery_1/173868.jpg,12,5
169690,Nike Unisex Zoom Superfly Elite - Bright Crimson/Blue Fox/Black/White,9945.0,11936.75,http://www.prodirectrunning.com/products/Nike-Unisex-Zoom-Superfly-Elite-Bright-Crimson-Blue-Fox-Black-White-Mens-Shoes-835996614-169690.aspx,The Nike Zoom Superfly Elite offers technical design to sprinters with an innovative spike plate with 8 changeable pins for optimal grip and a seamless woven upper for comfort and support.,http://www.prodirectrunning.com//productimages/V3_1_Main/169690.jpg,http://www.prodirectrunning.com//productimages/V3_1_Gallery_1/169690.jpg,13,5
177534,Brooks Caldera - Anthracite/Red Orange/Black,5950.0,7342.5,http://www.prodirectrunning.com/products/Brooks-Caldera-Anthracite-Red-Orange-Black-Mens-Shoes-1102421D075-177534.aspx,"Being thicker underfoot than any previous Brooks trail shoes, the Caldera delivers greater protection from uneven ground and allows you to run longer distances without the cushioning being compromised.The upper features a gusseted tongue and dual-layered mesh to keep debris out, enhance breathability and eliminate distractions. Made of sticky rubber, the outsole delivers superior traction and durability, primed for performance on rocky surfaces and hard-packed ground. The lugs dig into loose terrain for better grip on uneven surfaces.",http://www.prodirectrunning.com//productimages/V3_1_Main/177534.jpg,http://www.prodirectrunning.com//productimages/V3_1_Gallery_1/177534.jpg,13,5
169633,Nike Air Zoom Pegasus 34 - Hyper Royal/Royal Pulse/Obsidian,7650.0,9297.5,http://www.prodirectrunning.com/products/Nike-Air-Zoom-Pegasus-34-Hyper-Royal-Royal-Pulse-Obsidian-Mens-Shoes-880555409-169633.aspx,,http://www.prodirectrunning.com//productimages/V3_1_Main/169633.jpg,http://www.prodirectrunning.com//productimages/V3_1_Gallery_1/169633.jpg,12,5
169642,Nike Free RN 2017 - Black/Metallic Silver/Hot Punch,7267.5,8857.625,http://www.prodirectrunning.com/products/Nike-Free-RN-2017-Black-Metallic-Silver-Hot-Punch-Mens-Shoes-880839015-169642.aspx,,http://www.prodirectrunning.com//productimages/V3_1_Main/169642.jpg,http://www.prodirectrunning.com//productimages/V3_1_Gallery_1/169642.jpg,12,5
178008,Nike Zoom Fly - Hyper Royal/White,9945.0,11936.75,http://www.prodirectrunning.com/products/Nike-Zoom-Fly-Hyper-Royal-White-Mens-Shoes-880848411-178008.aspx,"This style features the darkside colourway which was distincitvely worn by the pacers in Nike’s ambitious and pioneering attempt to break the two-hour marathon barrier. The Zoom Fly echoes the features of the Vaporfly Elite, which was the shoe that Nike tailored to each individual athlete who took part in the official sub-two attempt. The Zoom Fly is designed with a carbon-infused nylon plate that is finely tuned to accommodate varying flex and mass for enhanced comfort and feel. Utilised alongside the core Lunarlon foam, this full-length plate strikes the balance between cushioning and stiffness for greater running efficiency.Meanwhile, with a lightweight foam rubber in the forefoot and a high-abrasion rubber in the heel, the outsole has optimal placement for enhanced traction, durability and efficiency. While not as tapered as something like the Vaporfly 4%, the Zoom Fly still ffers a truly unique feel that gives you a race-day feeling underfoot and versatility for daily training, too.",http://www.prodirectrunning.com//productimages/V3_1_Main/178008.jpg,http://www.prodirectrunning.com//productimages/V3_1_Gallery_1/178008.jpg,12.5,5
153403,Nike Free Rn 2017 - White/White-Black-Pure Platinum,6120.0,7538.0,http://www.prodirectrunning.com/products/Nike-Free-Rn-2017-White-WhiteBlackPure-Platinum-Mens-Shoes-880839100-153403.aspx,"Updated to reduce the layers and weight, the Nike Free RN 2017 brings you mile after mile of comfort. Featuring a breathable circular-knit upper, the shoe has an improved 1:1 fit and better support. Low-profile cushioning encourages a more natural footstrike while a minimal, moulded sockliner mimics the curvature of your foot for enhanced support.With a tri-star outsole pattern, the shoe adjusts to your foot’s every step, expanding and contracting for flexible cushioning. Finally, segments of solid rubber under the toe and heel enhance traction and durability.",http://www.prodirectrunning.com//productimages/V3_1_Main/153403.jpg,http://www.prodirectrunning.com//productimages/V3_1_Gallery_1/153403.jpg,13,5
171633,New Balance Zante V3 Reflective - Grey,5950.0,7342.5,http://www.prodirectrunning.com/products/New-Balance-Zante-V3-Reflective-Grey-Mens-Shoes-MZANTRC3-171633.aspx,"The Fresh Foam Zante v3 Reflective Running Shoe is streamlined for speed. They feature an aggressive toe spring for quick transition and a comfortable no-sew material application for a sleek, sock-like fit.",http://www.prodirectrunning.com//productimages/V3_1_Main/171633.jpg,http://www.prodirectrunning.com//productimages/V3_1_Gallery_1/171633.jpg,12,5
177568,adidas adizero Takumi sen - Blue/Silver/Easy Green,5950.0,7342.5,http://www.prodirectrunning.com/products/adidas-adizero-Takumi-sen-Blue-Silver-Easy-Green-Mens-Shoes-BB5674-177568.aspx,"With a focus on modern minimalist excellence for elite racing at 170g, the adidas adizero Takumi Sen 3 has an energy-returning boost™ foam forefoot that midsole that keeps every step charged with an endless supply of light fast energy.TORSION® SYSTEM support offers midfoot integrity and energised transition, while a grippy Continental® Rubber outsole offers traction and durability.",http://www.prodirectrunning.com//productimages/V3_1_Main/177568.jpg,http://www.prodirectrunning.com//productimages/V3_1_Gallery_1/177568.jpg,12,5
174271,adidas PureBOOST DPR - Solid Grey/White/Core Black,9350.0,11252.5,http://www.prodirectrunning.com/products/Mens-Shoes-adidas-PureBOOST-DPR-Solid-Grey-White-Core-Black-BB6291-174271.aspx,,http://www.prodirectrunning.com//productimages/V3_1_Main/174271.jpg,http://www.prodirectrunning.com//productimages/V3_1_Gallery_1/174271.jpg,12,5
171101,Saucony Guide ISO - Blue/Black,9180.0,11057.0,http://www.prodirectrunning.com/products/Mens-Shoes-Saucony-Guide-ISO-Blue-Black-S204152-171101.aspx,,http://www.prodirectrunning.com//productimages/V3_1_Main/171101.jpg,http://www.prodirectrunning.com//productimages/V3_1_Gallery_1/171101.jpg,12,5
148950,Nike Air Zoom Vomero 12 - Black/White/Anthracite,5865.0,7244.75,http://www.prodirectrunning.com/products/Nike-Air-Zoom-Vomero-12-Black-White-Anthracite-Mens-Shoes-863762001-148950.aspx,"The upper has been designed to provide ultimate comfort and ventilation where you need it the most. With a ¾ length internal bootie, the Vomero 12 wraps the foot for a sock-like fit and features a thick foam collar to add support and comfort to the ankle. The upper has been finished with Flywire cables which create an adaptive and supportive fit.  A dual-density midsole combines a soft Lunar core foam with a firmer Cushlon foam for a smooth heel-to-toe transition. The addition of Zoom Air units in the heel and forefoot help make the Vomero 12 an exceptionally energy-returning shoe.With a lightweight foam outsole, the Vomero 12 provides improved traction and durability. The updated rubber crash rail works to smooth transitions and enhance flexibility while segmented solid rubber under the heel further enhances the durability in critical areas of the shoe.",http://www.prodirectrunning.com//productimages/V3_1_Main/148950.jpg,http://www.prodirectrunning.com//productimages/V3_1_Gallery_1/148950.jpg,13,5
174268,adidas UltraBOOST - Grey/Core Black,12750.0,15162.5,http://www.prodirectrunning.com/products/Mens-Shoes-adidas-UltraBOOST-Grey-Core-Black-BB6167-174268.aspx,,http://www.prodirectrunning.com//productimages/V3_1_Main/174268.jpg,http://www.prodirectrunning.com//productimages/V3_1_Gallery_1/174268.jpg,12.5,5
89268,Nike Zoom Victory XC 3 - Black/Fierce Green-Photo Blue,4760.0,5974.0,http://www.prodirectrunning.com/products/Nike-Zoom-Victory-XC-3-Black-Fierce-GreenPhoto-Blue-Mens-Shoes-654693003-89268.aspx,Nike Zoom Victory XC 3 - Black/Fierce Green-Photo BlueThe Nike Victory XC 3 Unisex Cross Country Spike Shoe features a forefoot Pebax ® plate for excellent traction on challenging surfaces. Dynamic Flywire cables and a single-layer mono mesh upper deliver a lockdown fit and lightweight breathability.,http://www.prodirectrunning.com//productimages/V3_1_Main/89268.jpg,http://www.prodirectrunning.com//productimages/V3_1_Gallery_1/89268.jpg,13,5
153452,Nike Unisex Zoom Victory Elite 2 - Hyper Cobalt/White/Black/Ghost Green,6375.0,7831.25,http://www.prodirectrunning.com/products/Nike-Unisex-Zoom-Victory-Elite-2-Hyper-Cobalt-White-Black-Ghost-Green-Mens-Shoes-835998413-153452.aspx,"Part of the 2016 Nike track and field footwear collection which will be worn by athletes competing for the ultimate prize this summer, the Nike Unisex Zoom Victory Elite 2 Racing Spikes feature a breathable and supportive Flyknit upper and a plate that's designed to increase the foot's ability to drive propulsive force into the ground.",http://www.prodirectrunning.com//productimages/V3_1_Main/153452.jpg,http://www.prodirectrunning.com//productimages/V3_1_Gallery_1/153452.jpg,12,5
161760,Under Armour Charged Lightning - Stealth Gray,4165.0,5289.75,http://www.prodirectrunning.com/products/Under-Armour-Charged-Lightning-Stealth-Gray-Mens-Shoes-1285681008-161760.aspx,"Stay light and stay fast with the Men’s Charged Lightning running shoes from Under Armour. Every aspect is tailored for the runner looking for optimal speed from a lightweight, neutral performance shoe.The one-piece Charged Cushioning midsole is built low to the ground to bring you an even lighter and faster feel, while the solid rubber outsole ensures superb durability without adding unnecessary weight. With a 10mm offset, the Charged Lightning is best suited to midfoot or light heel strikers.",http://www.prodirectrunning.com//productimages/V3_1_Main/161760.jpg,http://www.prodirectrunning.com//productimages/V3_1_Gallery_1/161760.jpg,12,5
177578,Saucony Guide 10 - Slime/Black,5950.0,7342.5,http://www.prodirectrunning.com/products/Saucony-Guide-10-Slime-Black-Mens-Shoes-S203506-177578.aspx,"The engineered mesh upper provides a dynamic and lightweight fit that enhances breathability and comfort. In addition, the Guide 10 LR features lightweight FlexFilm overlays which equip the shoe with added structure and support. The FlexFilm fabric is melded to the upper in the shoe, eliminating the need for multiple layers and producing a seamless, flexible feel.The EVERUN topsole construction provides an enhanced energy return as well as plush cushioning that is designed to last for long distance runs.Designed to control moderate pronation and provide stability, the Guide 10 LR features added midfoot structure for the ideal hold and support for the runner in motion and a refined TRI-FLEX outsole design which provides greater ground contact and optimal flexibility.",http://www.prodirectrunning.com//productimages/V3_1_Main/177578.jpg,http://www.prodirectrunning.com//productimages/V3_1_Gallery_1/177578.jpg,12,5
173867,Nike Zoom D OC - Multi/Multi,3825.0,4898.75,http://www.prodirectrunning.com/products/Nike-Zoom-D-OC-Multi-Multi-Mens-Shoes-882022999-173867.aspx,"The Nike Unisex Zoom D has a 5-pin Pebax plate for optimal traction, along with a Cushlon foam midsole for responsive cushioning.",http://www.prodirectrunning.com//productimages/V3_1_Main/173867.jpg,http://www.prodirectrunning.com//productimages/V3_1_Gallery_1/173867.jpg,12,5
173869,Nike Zoom Maxcat 4 - Hyper Punch/Electric Green/Black,5100.0,6365.0,http://www.prodirectrunning.com/products/Nike-Zoom-Maxcat-4-Hyper-Punch-Electric-Green-Black-Mens-Shoes-549150603-173869.aspx,"The Nike Zoom Maxcat 4 Track Spike is ideal for 100m-800m sprints and is made with an ultra-lightweight mesh upper with Dynamic Flywire bundles for confident midfoot lockdown.The shoe features a low-profile Phylon midsole wedge to provide cushioning, while keeping the shoe light and low to the track.",http://www.prodirectrunning.com//productimages/V3_1_Main/173869.jpg,http://www.prodirectrunning.com//productimages/V3_1_Gallery_1/173869.jpg,12,5
177765,adidas Energy Boost 3 - Night Navy/Midnight Grey/Energy Orange,6120.0,7538.0,http://www.prodirectrunning.com/products/adidas-Energy-Boost-3-Night-Navy-Midnight-Grey-Energy-Orange-Mens-Shoes-BB5786-177765.aspx,,http://www.prodirectrunning.com//productimages/V3_1_Main/177765.jpg,http://www.prodirectrunning.com//productimages/V3_1_Gallery_1/177765.jpg,12,5
174269,adidas UltraBOOST - White,12750.0,15162.5,http://www.prodirectrunning.com/products/Mens-Shoes-adidas-UltraBOOST-White-BB6168-174269.aspx,,http://www.prodirectrunning.com//productimages/V3_1_Main/174269.jpg,http://www.prodirectrunning.com//productimages/V3_1_Gallery_1/174269.jpg,12.5,5
137939,Under Armour Micro G Assert 6 - Black,4590.0,5778.5,http://www.prodirectrunning.com/products/Under-Armour-Micro-G-Assert-6-Black-Mens-Shoes-1266224001-137939.aspx,"Utilising Micro G® foam, the Micro G Assert 6 provides ultimate cushioning for landings and take offs. Leather overlays on the upper add durability and secure the midfoot, while a full-length EVA sock liner improves comfort.",http://www.prodirectrunning.com//productimages/V3_1_Main/137939.jpg,http://www.prodirectrunning.com//productimages/V3_1_Gallery_1/137939.jpg,13,5
174304,adidas UltraBOOST Uncaged - White/White Tint/Core Black,12750.0,15162.5,http://www.prodirectrunning.com/products/Mens-Shoes-adidas-UltraBOOST-Uncaged-White-White-Tint-Core-Black-DA9157-174304.aspx,"Adidas UltraBOOST Uncaged running shoes are cage-free for a freer range of motion. An adidas Primeknit upper offers integrated support, while a Boost midsole delivers energy-returning cushioning for a powerful push-off. The grippy outsole offers superior traction in wet or dry conditions.",http://www.prodirectrunning.com//productimages/V3_1_Main/174304.jpg,http://www.prodirectrunning.com//productimages/V3_1_Gallery_1/174304.jpg,12,5
146609,Salomon Speedcross 4 - Black/Everglade/Sulphur Spring,6800.0,8320.0,http://www.prodirectrunning.com/products/Salomon-Speedcross-4-Black-Everglade-Sulphur-Spring-Mens-Shoes-L39239800-146609.aspx,"Designed for technical, soft ground, the 4th edition of the Speedcross builds upon previous generations with its efficient construction. A water resistant textile upper helps to prevent leakage, while the Contagrip® outsole provides ultimate traction on wet, muddy surfaces.New outsole geometry provides 22% more ground contact vs its predecessor; more surface ares means more grip.",http://www.prodirectrunning.com//productimages/V3_1_Main/146609.jpg,http://www.prodirectrunning.com//productimages/V3_1_Gallery_1/146609.jpg,12,5
174274,adidas PureBOOST DPR LTD - Core Black/Core Black/Carbon,11050.0,13207.5,http://www.prodirectrunning.com/products/Mens-Shoes-adidas-PureBOOST-DPR-LTD-Core-Black-Core-Black-Carbon-BB6303-174274.aspx,,http://www.prodirectrunning.com//productimages/V3_1_Main/174274.jpg,http://www.prodirectrunning.com//productimages/V3_1_Gallery_1/174274.jpg,12.5,5
148334,Hoka Rocket MD - Cyan/White,4505.0,5680.75,http://www.prodirectrunning.com/products/Hoka-Rocket-MD-Cyan-White-Mens-Shoes-1013925-148334.aspx,"Built with an asymmetrical spike placement to help athletes gain traction when speeding around corners, the Hoka Rocket MD is ideal for picking up the pace over distances between 400m and 1500m.The upper boasts exceptional breathability and flexibility for a more comfortable fit and feel, while the synthetic overlays provide your feet with lightweight support.",http://www.prodirectrunning.com//productimages/V3_1_Main/148334.jpg,http://www.prodirectrunning.com//productimages/V3_1_Gallery_1/148334.jpg,12,5
174305,adidas UltraBOOST Uncaged - Carbon/Core Black/Grey,12750.0,15162.5,http://www.prodirectrunning.com/products/Mens-Shoes-adidas-UltraBOOST-Uncaged-Carbon-Core-Black-Grey-DA9164-174305.aspx,"Adidas UltraBOOST Uncaged running shoes are cage-free for a freer range of motion. An adidas Primeknit upper offers integrated support, while a Boost midsole delivers energy-returning cushioning for a powerful push-off. The grippy outsole offers superior traction in wet or dry conditions.",http://www.prodirectrunning.com//productimages/V3_1_Main/174305.jpg,http://www.prodirectrunning.com//productimages/V3_1_Gallery_1/174305.jpg,12,5
148333,Hoka Speed Evo R - Rio,5355.0,6658.25,http://www.prodirectrunning.com/products/Hoka-Speed-Evo-R-Rio-Mens-Shoes-1014801-148333.aspx,"Featuring asymmetric spike patterns, the Hoka Speed Evo R spikes were created by designers to help combat centrifugal forces when approaching the turn on the track. The extra traction that these shoes provide can shave off fractions of a second, which adds up to a significant saving over longer distances. With roughly 60% of a track athlete’s race spent making left turns, a shoe that encourages enhanced traction to tackle this makes for a truly innovative design.As well as refining the spike plate and spike configuration, Hoka have updated the midsole support and cushioning elements of the shoe to enhance the comfort and create a more secure fit.",http://www.prodirectrunning.com//productimages/V3_1_Main/148333.jpg,http://www.prodirectrunning.com//productimages/V3_1_Gallery_1/148333.jpg,12,5
161764,Under Armour Charged Bandit 3 - Ultra Blue,4760.0,5974.0,http://www.prodirectrunning.com/products/Under-Armour-Charged-Bandit-3-Ultra-Blue-Mens-Shoes-1295725907-161764.aspx,"The Under Armour Charged Bandit 3 has a lightweight and breathable upper that offers flexible support, all put together with UA's innovative SpeedForm construction.",http://www.prodirectrunning.com//productimages/V3_1_Main/161764.jpg,http://www.prodirectrunning.com//productimages/V3_1_Gallery_1/161764.jpg,12,5
