Product Code/SKU,Product Name,Cost Price,Selling Price,Product URL,Description,Product Image1,Product Image2,Size,Quantity
145369,Saucony Womens Showdown 2 - Coral/Citron,3060.0,4019.0,http://www.prodirectrunning.com/products/Saucony-Showdown-2-Womens-Shoes-Coral-Citron-S190173-145369.aspx,"A new FlexFilm upper and ISOFIT lacing system combine to create a strong, lightweight sprint spike that provides a snug, sock-like fit and exceptional comfort. The FlexFilm encases most of the upper to deliver stability throughout without the addition of unnecessary weight or bulk.Precision-placed eyelets offer a fully-customisable fit for added comfort, while the Open Mesh design promotes great breathability to keep you cool and comfortable as you power to the finish line.Combining stiffness and durability for enhanced speed and greater efficacy through the stride, the Showdown 2 features a TPU-based Flexion Sole Plate. Ten Pyramid Spikes have been strategically placed to deliver optimum traction for unrelenting speed and aggressive acceleration out of the blocks.",http://www.prodirectrunning.com//productimages/V3_1_Main/145369.jpg,http://www.prodirectrunning.com//productimages/V3_1_Gallery_1/145369.jpg,10,5
161542,adidas Adizero Boston 6 - Ftwr White,6545.0,8026.75,http://www.prodirectrunning.com/products/adidas-Adizero-Boston-6-Ftwr-White-Mens-Shoes-CG3142-161542.aspx,"The Boston 6 is a lightweight shoe that is built for speed. Boost™ fuels every stride, working strategically with the lightweight STRETCHWEB outsole for an endless supply of light, fast energy. The boost™ construction is durable, adaptable and delivers an all-temperature performance. The engineered mesh upper provides a seamless, second-skin fit and breathability to keep feet cool and comfortable, while the TORSION® system between the heel and forefoot ensures a stable ride.",http://www.prodirectrunning.com//productimages/V3_1_Main/161542.jpg,http://www.prodirectrunning.com//productimages/V3_1_Gallery_1/161542.jpg,12,5
137732,adidas Adizero Accelerator - Ftwr White/Solar Red/Silver Met,7650.0,9297.5,http://www.prodirectrunning.com/products/adidas-Adizero-Accelerator-Ftwr-White-Solar-Red-Silver-Met-Mens-Shoes-BB4954-137732.aspx,"These race-ready track spikes are built to carry power sprinters at top speed. The moulded six-spike outsole provides maximum energy return. An ultra-light synthetic upper with support strap locks down the fit, and engineered mesh in the heel adds breathability.",http://www.prodirectrunning.com//productimages/V3_1_Main/137732.jpg,http://www.prodirectrunning.com//productimages/V3_1_Gallery_1/137732.jpg,12,5
161259,Nike Unisex Flyknit Streak - Green Abyss/Total Crimson/Black,7437.5,9053.125,http://www.prodirectrunning.com/products/Nike-Unisex-Flyknit-Streak-Green-Abyss-Total-Crimson-Black-Mens-Shoes-835994300-161259.aspx,"With a single layer Flyknit upper that wraps your foot in a second-skin fit, the unisex Nike Flyknit Streak running shoes offer lightweight support.A midfoot shank propels you through your stride while its anatomical design permits the toes to push off more efficiently. A phylon midsole with Zoom Air unit delivers responsive cushioning.Variable lug sizes on the outsole traction pattern optimise forward motion and flex grooves between them offer a natural range of movement.",http://www.prodirectrunning.com//productimages/V3_1_Main/161259.jpg,http://www.prodirectrunning.com//productimages/V3_1_Gallery_1/161259.jpg,12,5
161256,Nike Unisex Flyknit Streak - Black/Black/Wolf Grey/White,7480.0,9102.0,http://www.prodirectrunning.com/products/Nike-Unisex-Flyknit-Streak-Black-Black-Wolf-Grey-White-Mens-Shoes-835994003-161256.aspx,"With a single layer Flyknit upper that wraps your foot in a second-skin fit, the unisex Nike Flyknit Streak running shoes offer lightweight support.A midfoot shank propels you through your stride while its anatomical design permits the toes to push off more efficiently. A phylon midsole with Zoom Air unit delivers responsive cushioning.Variable lug sizes on the outsole traction pattern optimise forward motion and flex grooves between them offer a natural range of movement.",http://www.prodirectrunning.com//productimages/V3_1_Main/161256.jpg,http://www.prodirectrunning.com//productimages/V3_1_Gallery_1/161256.jpg,12,5
161258,Nike Unisex Flyknit Streak - Wolf Grey/Black/Anthracite/Pure Platinum,7437.5,9053.125,http://www.prodirectrunning.com/products/Nike-Unisex-Flyknit-Streak-Wolf-Grey-Black-Anthracite-Pure-Platinum-Mens-Shoes-835994007-161258.aspx,"With a single layer Flyknit upper that wraps your foot in a second-skin fit, the unisex Nike Flyknit Streak running shoes offer lightweight support.A midfoot shank propels you through your stride while its anatomical design permits the toes to push off more efficiently. A phylon midsole with Zoom Air unit delivers responsive cushioning.Variable lug sizes on the outsole traction pattern optimise forward motion and flex grooves between them offer a natural range of movement.",http://www.prodirectrunning.com//productimages/V3_1_Main/161258.jpg,http://www.prodirectrunning.com//productimages/V3_1_Gallery_1/161258.jpg,12.5,5
155332,ASICS Gel-Kinsei 6 - Carbon/Black/Electric Blue,10455.0,12523.25,http://www.prodirectrunning.com/products/ASICS-GelKinsei-6-Carbon-Black-Electric-Blue-Mens-Shoes-T644N9790-155332.aspx,,http://www.prodirectrunning.com//productimages/V3_1_Main/155332.jpg,http://www.prodirectrunning.com//productimages/V3_1_Gallery_1/155332.jpg,12,5
155344,ASICS Gel-Quantum 360 Knit - White/Snow/Silver,9860.0,11839.0,http://www.prodirectrunning.com/products/ASICS-GelQuantum-360-Knit-White-Snow-Silver-Mens-Shoes-T728N0100-155344.aspx,"Utilising rearfoot and forefoot GEL Cushioning Systems, the Gel-Quantum 360 Knit attenuates shock during impact and toe-off phases, thereby allowing movement in multiple planes as the foot moves through the gait cycle.With an exoskeletal heel counter that creates a secure, supportive fit and a virtually seamless upper, which reduces friction and irritation, the shoe offers exceptional comfort. The ComforDry Sockliner provides plush underfoot cushioning for a superb feel and also benefits from moisture-managing properties and breathability.",http://www.prodirectrunning.com//productimages/V3_1_Main/155344.jpg,http://www.prodirectrunning.com//productimages/V3_1_Gallery_1/155344.jpg,12,5
155347,ASICS Gel-Kenun - White/White/Glacier Grey,7735.0,9395.25,http://www.prodirectrunning.com/products/ASICS-GelKenun-White-White-Glacier-Grey-Mens-Shoes-T7C4N0101-155347.aspx,"As good for your feet as they are for your image, the GEL-Kenun from ASICS boasts a sleek and stylish design that is at home just about anywhere. Highly versatile, they feature GEL technology for superb rearfoot cushioning and a streamlined upper that is seamless, lightweight and breathable.Finished with an Ortholite sockliner, these shoes provide exceptional moisture management to keep your feet feeling fresh and comfortable.",http://www.prodirectrunning.com//productimages/V3_1_Main/155347.jpg,http://www.prodirectrunning.com//productimages/V3_1_Gallery_1/155347.jpg,12,5
155325,ASICS Gel-Kayano 24 - Black/Green Gecko/Phantom,8925.0,10763.75,http://www.prodirectrunning.com/products/ASICS-GelKayano-24-Black-Green-Gecko-Phantom-Mens-Shoes-T749N9085-155325.aspx,"The ASICS Gel-Kayano 24 was made for long distance running, featuring an even lighter weight design and exceptional, long-lasting cushioned comfort. With more than twenty years of experience behind it, this shoe offers precision support, with structure that’s designed to help correct overpronation.With a fibre-reinforced midsole, the Kayano 24 adapts to your foot shape, providing cushioning that increases the stability the more you roll your foot.Thanks to the outstanding FlyteFoam midsole, updated to be even lighter than previous versions, the Kayano 24 attenuates shock while simultaneously allowing for a snappy response.",http://www.prodirectrunning.com//productimages/V3_1_Main/155325.jpg,http://www.prodirectrunning.com//productimages/V3_1_Gallery_1/155325.jpg,13,5
155345,ASICS Gel-Kenun - Dark Grey/Black/Green Gecko,7735.0,9395.25,http://www.prodirectrunning.com/products/ASICS-GelKenun-Dark-Grey-Black-Green-Gecko-Mens-Shoes-T7C4N9590-155345.aspx,"As good for your feet as they are for your image, the GEL-Kenun from ASICS boasts a sleek and stylish design that is at home just about anywhere. Highly versatile, they feature GEL technology for superb rearfoot cushioning and a streamlined upper that is seamless, lightweight and breathable.Finished with an Ortholite sockliner, these shoes provide exceptional moisture management to keep your feet feeling fresh and comfortable.",http://www.prodirectrunning.com//productimages/V3_1_Main/155345.jpg,http://www.prodirectrunning.com//productimages/V3_1_Gallery_1/155345.jpg,12,5
146284,ASICS Gel-Nimbus 19 - Black/Onyx/Silver,8670.0,10470.5,http://www.prodirectrunning.com/products/ASICS-GelNimbus-19-Black-Onyx-Silver-Mens-Shoes-T700N9099-146284.aspx,"Featuring ASICS’ revolutionary FlyteFoam technology, the Gel Nimbus 19 provides the optimal comfort and a truly responsive ride, ideal for the neutral runner. The seamless, FluidFit upper construction is made with a jacquard mesh that is strategically tightened or loosened in key zones to allow the foot great natural movement.3D printed overlays provide seamless support to the upper, while the Heel Clutching System technology uses an exoskeletal heel counter to lock your heel in, adding stability and creating a secure fit. ASICS’ Guidance Trusstic System helps to smooth the step transition and works with a Guidance Line for enhanced gait efficiency that simultaneously provides midfoot integrity.Enhancing the comfort of the shoe, the Gel Nimbus 19 has a premium Comfordry X-40 Sockliner that delivers high rebound properties, whilst improving breathability and wicking moisture for a drier and more comfortable run.",http://www.prodirectrunning.com//productimages/V3_1_Main/146284.jpg,http://www.prodirectrunning.com//productimages/V3_1_Gallery_1/146284.jpg,13,5
163670,adidas Adizero Long Jump - Mystery Petrol F17/Ftwr White/Petrol Night F17,7650.0,9297.5,http://www.prodirectrunning.com/products/adidas-Adizero-Long-Jump-Mystery-Petrol-F17-Ftwr-White-Petrol-Night-F17-Mens-Shoes-BB3540-163670.aspx,"Hit your approach with power and speed in the Adizero Long Jump spikes from adidas. Designed for high performance, these spikes are built low to the ground for optimal efficiency. They feature a cushioned midsole and mesh at the midfoot and heel for lightweight comfort and superb breathability. The sharkskin-textured seven-spike forefoot provides reliable traction in wet and dry conditions.",http://www.prodirectrunning.com//productimages/V3_1_Main/163670.jpg,http://www.prodirectrunning.com//productimages/V3_1_Gallery_1/163670.jpg,12,5
171657,OOFOS OOriginal Sport Womens - Black,4080.0,5192.0,http://www.prodirectrunning.com/products/Oofos-OOriginal-Sport-Womens-Black-1001BlackWomens-171657.aspx,"The Women's OOriginal takes on new life in the OOriginal Sport. With bold OO graphics and two-tone upper, the OOriginal Sport is perfect for both men and women. The OOfoam footbed provides impact absorption, superior arch support, and unbelievable comfort.",http://www.prodirectrunning.com//productimages/V3_1_Main/171657.jpg,http://www.prodirectrunning.com//productimages/V3_1_Gallery_1/171657.jpg,8,5
145686,adidas Ultraboost - Collegiate Navy,9520.0,11448.0,http://www.prodirectrunning.com/products/adidas-Ultraboost-Collegiate-Navy-Mens-Shoes-BA8843-145686.aspx,"Boost™ features in the midsole for an exceptional, energy-returning ride. The unique cell structure of boost™ allows each capsule to store and then unleash energy, providing durable, adaptable, all-temperature performance. STRETCHWEB adapts to every runner’s foot strike by unleashing the full potential of boost™ and provides a smoother and more flexible ride.While the TORSION SYSTEM® supports the arch and provides midfoot integrity, the FITFRAME 3D-moulded TPU helps to increase stability around the heel and enables the free motion of the Achilles tendon. The Ultraboost features a Primeknit construction, which reduces irritation and moulds to the contours of the foot, delivering a precision fit and a secure, locked-in feel. The Continental™ rubber outsole provides superior traction in both wet and dry conditions.Please note due to high demand these will be limited to 1 per customer.",http://www.prodirectrunning.com//productimages/V3_1_Main/145686.jpg,http://www.prodirectrunning.com//productimages/V3_1_Gallery_1/145686.jpg,12,5
155346,ASICS Gel-Kenun - Phantom/Black/White,7735.0,9395.25,http://www.prodirectrunning.com/products/ASICS-GelKenun-Phantom-Black-White-Mens-Shoes-T7C4N1690-155346.aspx,"As good for your feet as they are for your image, the GEL-Kenun from ASICS boasts a sleek and stylish design that is at home just about anywhere. Highly versatile, they feature GEL technology for superb rearfoot cushioning and a streamlined upper that is seamless, lightweight and breathable.Finished with an Ortholite sockliner, these shoes provide exceptional moisture management to keep your feet feeling fresh and comfortable.",http://www.prodirectrunning.com//productimages/V3_1_Main/155346.jpg,http://www.prodirectrunning.com//productimages/V3_1_Gallery_1/155346.jpg,12,5
155326,ASICS Gel-Kayano 24 - Silver/Black/Mid Grey,8925.0,10763.75,http://www.prodirectrunning.com/products/ASICS-GelKayano-24-Silver-Black-Mid-Grey-Mens-Shoes-T749N9390-155326.aspx,"The ASICS Gel-Kayano 24 was made for long distance running, featuring an even lighter weight design and exceptional, long-lasting cushioned comfort. With more than twenty years of experience behind it, this shoe offers precision support, with structure that’s designed to help correct overpronation.With a fibre-reinforced midsole, the Kayano 24 adapts to your foot shape, providing cushioning that increases the stability the more you roll your foot.Thanks to the outstanding FlyteFoam midsole, updated to be even lighter than previous versions, the Kayano 24 attenuates shock while simultaneously allowing for a snappy response.",http://www.prodirectrunning.com//productimages/V3_1_Main/155326.jpg,http://www.prodirectrunning.com//productimages/V3_1_Gallery_1/155326.jpg,13,5
145696,adidas Mana Bounce 2 - Core Black,4080.0,5192.0,http://www.prodirectrunning.com/products/adidas-Mana-Bounce-2-Core-Black-Mens-Shoes-B39021-145696.aspx,"The instant, step-in comfort of the adidas Mana Bounce 2 Aramis allows you to push for the extra mile with confidence. Made with a BOUNCE midsole, the cushioning offers great energy return, charging each step and ensuring you feel light and fast on your feet.A closed mesh upper allows for breathability while the addition of a haptic print overlay provides seamless, targeted support.",http://www.prodirectrunning.com//productimages/V3_1_Main/145696.jpg,http://www.prodirectrunning.com//productimages/V3_1_Gallery_1/145696.jpg,12,5
155376,Asics Womens Fuze X Lyte 2 - Airy Blue/Astral Aura/Flash Coral,3655.0,4703.25,http://www.prodirectrunning.com/products/Asics-Womens-Fuze-X-Lyte-2-Airy-Blue-Astral-Aura-Flash-Coral-Womens-Shoes-T769N3933-155376.aspx,"The ASICS fuzeX Lyte 2 features fuzeGEL, which uses a combination of gel and foam to create a lightweight, comfortable and adaptable layer of cushioning that provides rearfoot shock absorption and slingshots the forefoot at take-off.The mesh upper facilitates breathability and comfort, while the seamless construction enhances the fit further by reducing the chance of irritation and friction and providing a smooth feel.Featuring high abrasion rubber on critical areas of the outsole, the fuzeX Lyte 2 delivers exceptional resilience and durability.",http://www.prodirectrunning.com//productimages/V3_1_Main/155376.jpg,http://www.prodirectrunning.com//productimages/V3_1_Gallery_1/155376.jpg,8,5
155358,Asics Womens GT-2000 5 - Cosmo Pink/Black/White,5100.0,6365.0,http://www.prodirectrunning.com/products/Asics-Womens-GT2000-5-Cosmo-Pink-Black-White-Womens-Shoes-T757N2090-155358.aspx,"With a FluidRide midsole, the ASICS GT-2000 5 delivers superior cushioning as well as exceptional bounce-back for a charged and responsive ride. The shoes feature Trusstic System technology in addition to the Guidance Line Midsole technology, which both work to enhance your gait efficiency and deliver midfoot structural integrity.As a structured shoe, the GT-2000 5 utilises ASICS’ Heel Clutching System Technology to secure the heel in place and improve the support. The added stitch-down toecap provides enhanced stability in the forefoot as well as enhanced durability in one of the critical wear zones.The GT-2000 5 features a removable Comfordry sockliner, which provides added cushioning as well as moisture-wicking properties for a cool, dry and healthy environment for your feet. With gender-specific cushioning, this model is specifically tailored to women, featuring a lower-density top layer in the midsole, which allows female athletes to better enjoy the benefits of midsole compression.",http://www.prodirectrunning.com//productimages/V3_1_Main/155358.jpg,http://www.prodirectrunning.com//productimages/V3_1_Gallery_1/155358.jpg,8,5
171656,OOFOS OOahh Womens - Black,3400.0,4410.0,http://www.prodirectrunning.com/products/Oofos-OOahh-Womens-Black-1100BlackWomens-171656.aspx,"The OOFOS Women's OOahh holds tight and conforms to your foot to ensure incredible impact absorption, arch support and natural motion. Ideal for post-workout recovery — with moisture and bacteria resistance that make it great for the shower.",http://www.prodirectrunning.com//productimages/V3_1_Main/171656.jpg,http://www.prodirectrunning.com//productimages/V3_1_Gallery_1/171656.jpg,8,5
155361,Asics Womens GT-1000 6 - High Rise/Carbon/Flash Coral,4505.0,5680.75,http://www.prodirectrunning.com/products/Asics-Womens-GT1000-6-High-Rise-Carbon-Flash-Coral-Womens-Shoes-T7A9N9697-155361.aspx,"Featuring a SPEVA midsole, the GT-1000 6 from ASICS delivers ultra-soft cushioning and increased energy return for comfort and support over any distance. The Dynamic Duomax support system utilises a dual-density material in the midfoot, which gives you just enough support to reduce moderate overpronation.Meanwhile an engineered mesh upper offers a structured wrap for optimal comfort and lightweight breathability. Carbon rubber features in the heel for exceptional durability, while DuraSponge in the forefoot, made from a blown AHAR compound, works to deliver responsive cushioning and flexibility.",http://www.prodirectrunning.com//productimages/V3_1_Main/155361.jpg,http://www.prodirectrunning.com//productimages/V3_1_Gallery_1/155361.jpg,8,5
174807,Nike Unisex Zoom Streak 6 - Mulit-Color/Multi-Color,4250.0,5387.5,http://www.prodirectrunning.com/products/Nike-Unisex-Zoom-Streak-6-MulitColor-MultiColor-Mens-Shoes-831413999-174807.aspx,"The Nike Zoom Streak 6 is a unisex shoe that is primed for road racing with a lightweight, minimal design. A Flymesh upper provides breathable comfort and features specifically engineered zones of ventilation and structure. With an anatomical toe design that follows the contours of your foot, the Nike Zoom Streak 6 allows your toes to splay and push off the ground with great explosiveness.",http://www.prodirectrunning.com//productimages/V3_1_Main/174807.jpg,http://www.prodirectrunning.com//productimages/V3_1_Gallery_1/174807.jpg,10.5,5
153401,Nike Free RN Motion Flyknit 2017 - Black,8500.0,10275.0,http://www.prodirectrunning.com/products/Nike-Free-RN-Motion-Flyknit-2017-Black-White-Pure-Platinum-Wolf-Grey-Mens-Shoes-880845001-153401.aspx,"The Men’s Nike Free RN Motion Flyknit 2017 Running Shoes have been designed to give you the most natural ride yet. With an auxetic outsole that expands and adjusts to your foot’s every step and a lace-free, Flyknit-constructed upper that fits like a glove, these shoes offer superb flexibility, ventilation and snug comfort.Featuring an anatomical heel that is rounded to roll with the ground, the Free RN Motion Flyknit 2017 promotes a more natural range of motion.Please note, the design and colour may vary slightly from images shown above.",http://www.prodirectrunning.com//productimages/V3_1_Main/153401.jpg,http://www.prodirectrunning.com//productimages/V3_1_Gallery_1/153401.jpg,13,5
155365,Asics Womens Gel-Cumulus 19 - Black/Silver Pink/Peacock,5100.0,6365.0,http://www.prodirectrunning.com/products/Asics-Womens-GelCumulus-19-Black-Silver-Pink-Peacock-Womens-Shoes-T7B8N9093-155365.aspx,"Enjoy mile after mile of comfort underfoot in the GEL-Cumulus 19 from ASICS. The Convergence GEL technology ensures shock attenuation during impact and toe-off phases to help give you smooth, comfortable transitions and allows movement in multiple planes as the foot moves through the gait cycle.The seamless construction greatly minimises the potential for irritation and friction caused by traditional stitches and seams. Finally, sporting a modern upper, the Cumulus 19 delivers more than just comfort and support, bringing you contemporary style as well.",http://www.prodirectrunning.com//productimages/V3_1_Main/155365.jpg,http://www.prodirectrunning.com//productimages/V3_1_Gallery_1/155365.jpg,8,5
155367,Asics Womens Gel-Noosa FF - Black/Hot Orange/Pink Peacock,5355.0,6658.25,http://www.prodirectrunning.com/products/Asics-Womens-GelNoosa-FF-Black-Hot-Orange-Pink-Peacock-Womens-Shoes-T772N9030-155367.aspx,"Reinvented to include ASICS’ revolutionary FlyteFoam technology, the GEL-Noosa FF remains a triathlon staple with a responsive ride at an even lighter weight. The seamless upper features a technical mesh that reduces irritation and chafing and enhances the overall comfort, allowing you to wear the shoes without socks.The wet-grip outsole and heel and tongue grips facilitate an easy on and off, ideal for triathletes looking to make a quick transition between race stages. With a high abrasion rubber placed in critical areas of the outsole, the Gel-Noosa FF delivers exceptional durability where it is needed the most.",http://www.prodirectrunning.com//productimages/V3_1_Main/155367.jpg,http://www.prodirectrunning.com//productimages/V3_1_Gallery_1/155367.jpg,8,5
155374,Asics Womens Fuze X Rush - White/Silver/Mid Grey,4250.0,5387.5,http://www.prodirectrunning.com/products/Asics-Womens-Fuze-X-Rush-White-Silver-Mid-Grey-Womens-Shoes-T768N0193-155374.aspx,"The seamless construction of the ASICS fuzeX Rush Running Shoe reduces irritation and friction caused by stitching and seams, ensuring a comfortable fit that minimises distractions and keeps you focussed on your run.With the addition of fuzeGEL cushioning from heel to toe, the shoe delivers lightweight and adaptable comfort, designed to provide rearfoot shock absorption that shifts to forefoot bounce-back. For added protection and comfort, the fuzeX Rush features a sockliner, which can be removed to accommodate a medical orthotic if required.  A high abrasion rubber has been strategically placed on the critical areas of the outsole, ensuring maximum durability.",http://www.prodirectrunning.com//productimages/V3_1_Main/155374.jpg,http://www.prodirectrunning.com//productimages/V3_1_Gallery_1/155374.jpg,8,5
155366,Asics Womens Gel-Pulse 9 - Cosmo Pink/Silver/Black,3655.0,4703.25,http://www.prodirectrunning.com/products/Asics-Womens-GelPulse-9-Cosmo-Pink-Silver-Black-Womens-Shoes-T7D8N2093-155366.aspx,,http://www.prodirectrunning.com//productimages/V3_1_Main/155366.jpg,http://www.prodirectrunning.com//productimages/V3_1_Gallery_1/155366.jpg,8,5
147273,adidas adizero Javelin 2 - Black/White,6375.0,7831.25,http://www.prodirectrunning.com/products/adidas-adizero-Javelin-2-Black-White-Mens-Shoes-B44533-147273.aspx,"With a hook-and-loop strap around the midfoot, the adidas adizero Javelin 2 Track Spike works to provide additional comfort and support for javelin-specific motions and movements. Featuring microsuede in the shoe’s interior, you’ll experience ultimate comfort and have the added benefit of increased durability in high-tension areas of the foot.The sharkskin outsole delivers uncompromised grip and is lightweight, allowing for an aggressive launch into the throw. A carbon rubber toe cap has been designed to add extra protection and durability during toe-off of the javelin throwing motion. A SPRINTWEB upper creates a much lighter overall shoe, without compromising on durability or breathability. Thanks to its soft, cushioned collar, the adizero Javelin 2 helps to reduce pressure on the ankle and Achilles, normally caused by the throwing action.",http://www.prodirectrunning.com//productimages/V3_1_Main/147273.jpg,http://www.prodirectrunning.com//productimages/V3_1_Gallery_1/147273.jpg,14.5,5
